{"aggregate_verdict":"pass","candidate_implementation_independent":true,"case_author_independent":true,"cases_reviewed":24,"detailed_receipt_sha256":"3930c6598664e0aca0e3c2d3dfafc38b19d7407d4fafd94c259da07c03e7824e","fairness_policy_sha256":"f68370155ad262e7d04484d86fddee11a0d34bfce9cff84fb3f6fe376390619c","ordered_case_commitment_set_sha256":"052b2725404f22e4f926feb8ed9cd028f7b3d7773c92fb30d4611c05c6334ee9","reviewer_class":"isolated-agent","reviewer_id":"isolated-agent-reviewer-c","schema_version":"fairness-receipt-v1"}
