{"aggregate_verdict":"pass","candidate_implementation_independent":true,"case_author_independent":true,"cases_reviewed":24,"detailed_receipt_sha256":"b0cb1756981217c775dcea5e9a7274c21c6247e47c0769d06ced7eec6a5b3c88","fairness_policy_sha256":"f68370155ad262e7d04484d86fddee11a0d34bfce9cff84fb3f6fe376390619c","ordered_case_commitment_set_sha256":"052b2725404f22e4f926feb8ed9cd028f7b3d7773c92fb30d4611c05c6334ee9","reviewer_class":"isolated-agent","reviewer_id":"isolated-agent-reviewer-g","schema_version":"fairness-receipt-v1"}
